Question,Answer,,,,,,
What is mock trading? Why there is a movement in stock prices when market is closed?,"Mock trading sessions are generally conducted by stock exchanges to test the performance of their system to enable flawless trading. The mock trading is is scheduled on the first Saturday of the month for commodity derivatives, equity derivatives, currency derivatives, and equity segments.

Your holdings or position value is displayed as per the mock-trading prices. Due to this, you may see incorrect prices on the Market watch and also incorrect positions or holdings value. However, at the end of the session, Friday's closing will be updated.",,,,,,
Can I buy and sell shares by calling up Shoonya ?,"Yes, we provide a call and trade facility. You can contact our dealing desk from your registered number and place your trades. 

Please find below dealing desk numbers: 

+91 1726 750 000

0172-474 0000

Press 1 for Trading. 

Note: For selling your holding through call and trade, you should have POA linked. 

",,,,,,
What is an AMO and when can we place it?,"AMO  is after-market Orders which helps you to place an order beyond the regular trading hours. This is especially helpful for people who can’t actively track the markets during the live session - 9:15 am to 3:30 pm.

AMO orders can be placed only during the following time duration –

Equity - 4:00 PM to 8:59 AM for NSE and BSE

Currency - 5.00 PM to 8:59 AM

F&O – 3:30 PM to 9:14 AM

MCX (MAR TO NOV) – 11:30 PM to 8:59 AM

MCX (DEC TO FEB) - 11:55 PM to 8:59 AM

Note: We don't allow AMO in between 08.00 AM to 8:15 AM

",,,,,,
What is auction ?,"An auction is a mechanism where an exchange auctions the investor's stock holding when the person has sold the stock but is unable to deliver it within a stipulated time period.

When you sell shares and cannot deliver them back to the buyer for which he had already paid money, in such a scenario, the exchange calls for an auction. So your broker will try to purchase the shares in a buy-in auction market on T+2 day and the settlement of the auction shall be done on T+3 day (holidays are not included).

",,,,,,
How is auction conducted?,"The auction is conducted every day between 2:00 pm and 2:45 pm. Only member brokers of the exchange can participate and sell shares that are short-delivered. To avoid any conflict of interest the exchange doesn’t allow members whose client has defaulted (short delivered) to take part in the auction.

There is no fixed price for the Auction to happen. The exchange specifies a range within which the auction participants can offer to sell their shares.",,,,,,
Can I use the profits I made from trading in F&O to trade on the same day?,"Profit of the F&O segment will be credited to the ledger's next working day, You cannot use the profit amount on the same day for new positions.",,,,,,
How to do BTST in Shoonya? How much margin is required to do BTST?,"Yes, Shoonya provides BTST (Buy Today, Sell Tomorrow) in Shoonya. 
Important update regarding BTST and margins
In reference to the recent margin changes in the Cash segment only, the following shall be applicable with immediate effect : 
BTST is allowed: The client can buy on T day and sell on T1 day. Please note, on T1 day, you need to have Var+ELM+Adhoc margin for selling the BTST position.
Further, you shall not be able to buy a new position on T1 day from the released margin after selling the shares.
Let us explain with examples. 

You bought A shares of Rs 1,00,000 on T day. For BTST, you need to have a Var+ELM+Adhoc margin for the quantity to be sold on T1. Say, the margin required for the selling is Rs 30,000. Once you have sold the position, Rs 30,000 shall be blocked for both T1 and T2 days from your available margin. Please note, the released margin of shares sold on T1 of Rs 1,00,000 shall be available on T3 day.",,,,,,
What are ASM & GSM?,"ASM: (Additional Surveillance Measure)

The securities and Exchange Board of India (SEBI) and Exchanges to enhance market integrity and safeguard the interest of investors, have been introducing various enhanced pre-emptive surveillance measures such as reduction in price band, periodic call auction, and transfer of securities to Trade for Trade segment from time to time.

In continuation to various surveillance measures already implemented, SEBI and Exchanges, pursuant to discussions in joint surveillance meetings, have decided that along with the aforesaid measures, there shall be Additional Surveillance Measures (ASM) on securities with surveillance concerns based on objective parameters, viz. Price / Volume variation, Volatility, etc.
For more information, please find the below link: 

https://www.nseindia.com/regulations/additional-surveillance-measure

--Buying in ASM shares is allowed with Shoonya; you can not trade intraday, and BTST is not allowed (even with or without poa).

GSM: Graded Surveillance Measure

GSM is a system designed by Sebi to keep a check on shares that see abnormal price rise. It directed stock exchanges to place these companies under the Graded Surveillance Measure (GSM).

For more information, please find the below link: 

https://www.nseindia.com/regulations/graded-surveillance-measure

--Currently, we don't provide trading in GSM category shares.",,,,,,
What are pre-market and post-market sessions and orders?,"Pre-open session: 
NSE started the concept of the pre-open session to minimize the volatility of securities during the market open every day. Between 9:00 AM to 9:15 AM is when the pre-market session is conducted on NSE.

During the pre-market session for the first 8 minutes (between 9:00 AM and 9:08 AM) orders are collected, modified, or canceled. You can place limit orders. The order collection window can close
 
The post-market session or closing session is open from 3:40 PM to 4:00 PM. During this session, people can place buy/sell orders in equity (delivery segment using the CNC product code) at the market price but do note that even if you place a market order it will be placed on the exchange at the closing price.",,,,,,
What will happen if I don't square off my Option contract on expiry day?,"The options contract will be physically settled if it's in the money. For contracts where delivery based physical settlement does not take place, the implication is as follows -

If you have bought options:

-In the money - STT on exercised contracts will be charged at the rate of 0.125% of intrinsic value (how much in-the-money the option is) and not on the total contract value. 

-Out of the money -OTM option contracts will expire worthlessly. You will lose the entire amount paid as a premium.

If you have shorted options:

STT for options is only on the sell-side which means you would've paid STT when initiating the short. So, there will be no STT impact on expiry. Depending on the moneyness of the option contract, you get to keep the premiums ",,,,,,
What are the exchange timings of all segments?,"For equity and F&O market :

9:15 am to 03:30 pm, Monday to Friday.



For the commodity (MCX) market : 

9:00 AM to 11:30 PM Monday to Friday (From MARCH to NOV)

9:00 AM to 11:55 PM Monday to Friday (From DEC to FEB)



For Agri-community (NCDEX) market :

9:00 AM to 9:00 PM, Monday to Friday



For Currency:

9:00 AM to 5:00 PM (Monday to Friday)



For Cross currency 

9:00 AM to 5.00 PM (Monday to Friday)


  ",,,,,,
What is auto square off timings of all segments?,"Please do check square off timings segment-wise below:

NSE CASH 3:20 PM

NSE NFO 3:25 PM

NSE CDS 4:45 PM

NSE CDS cross-currency 4.45 pm

MCX (MAR TO NOV) 11:15 PM

MCX (DEC TO FEB) 11:40 PM


  ",,,,,,
How can we participate in the buyback?,"Participating in the buyback process is straightforward if you hold stocks on the record date. Here's a step-by-step guide to assist you: -

Early Pay-In Buyback (Exchange: NSE)

1. Registration Process - 

i) Register for the CDSL EASIEST facility from the below link - https://web.cdslindia.com/myeasitoken/Registration/EasiestRegistration

ii) Add our pool account (1208430000000070) as a trusted account.

2. Approval and TPIN - After approval, you'll receive a password and TPIN on your registered email. Change your TPIN from the Miscellaneous section.

3. Early Pay-In Setup -

-Go to Transaction > Setup > Select National Stock Exchange of India Limited as the exchange. 

-Choose Market Type as Tender Offer. 

-Find and select the appropriate Settlement ID (121155******). 

-For CM ID, select M51912. 

-For the target BO ID, it will autofill. 

-Click on UCC Detail, select (EX-12, UCC-FA*****, Segment Code-01, CM ID-M51912, TM Code-14846), and then click Add ISIN. Choose the ISIN (INE*******) in the new popup and add the quantity. 

-Submit, and on the new page, select the transaction, commit, and enter TPIN.

 4. Raise Prism Ticket - After verification, raise a Prism ticket in the Others category. Provide details like client code, name, PAN number, and quantity.

Check the Exchange Circular for Settlement numbers or contact our Support Team. Circular Link: NSE Circular https://www.nseindia.com/resources/exchange-communication-circulars

Note - Unpledge any stocks before the early pay-in setup.



Early Pay-In Buyback (Exchange: BSE)

1. Registration Process - 

i) Register for the CDSL EASIEST facility from the below link - https://web.cdslindia.com/myeasitoken/Registration/EasiestRegistration

ii) Add our pool account (1208430000000091) as a trusted account.

2. Approval and TPIN - After approval, you'll receive a password and TPIN on your registered email. Change your TPIN from the Miscellaneous section.

3. Early Pay-In Setup - 

-Go to Transaction > Setup > Choose Bombay Stock Exchange of India Limited as the exchange. 

-Select Market Type as Buy Back. Find and select the appropriate Settlement ID (111056******). 

-For CM ID, select 4043. 

-For the target BO ID, it will autofill. Click on UCC Detail, select (EX-11, UCC-FA*****, Segment Code-01, CM ID-M51912, TM Code-4043), and then click Add ISIN. In the new popup, choose the company's ISIN (INE******) and add the quantity. 

-Submit, and on the new page, select the transaction, commit, and enter TPIN.

4. Raise Prism Ticket - Similar to NSE, after verification, raise a Prism ticket in the Others category. Provide client code, name, PAN number, and quantity.

-Consult the Exchange Circular for Settlement numbers or contact our Support Team. Circular Link: BSE Circulars

https://www.bseindia.com/markets/MarketInfo/NoticesCirculars.aspx?id=0&txtscripcd=&pagecont=&subject=
Note - Unpledge any stocks before the early pay-in setup.


  
",,,,,,
Does Shoonya provide advisory services or tips?,"No, we do not provide tips and advice for trading.

",,,,,,
What are Cover order and Bracket order?,"Cover order - Order for intraday trading where a SL order is placed parallel to the main order. This Stop Loss Order cannot be canceled. Since the Stop Loss Order is being placed simultaneously while getting into the contract, the risk that is being taken automatically reduces.

Bracket Order-It is a 2 leg order for intra-day trading. Both SL and TP are placed parallel with the main order. If any of the SL / TP orders is executed, then the other order is auto-canceled.

There are no charges for bracket orders and cover orders in Shoonya.
",,,,,,
How to check stock purchase price?,"Once you have bought the shares then their purchasing value or price will reflect in your trading platform, contract note, and in the back office.
",,,,,,
What is BTST?,"BTST (Buy Today, Sell Tomorrow)

In a normal equity delivery trade (buy/sell of stocks using CNC order), the transaction is complete in T+2 days, where T is the trading day. The buyer gets shares in his Demat account, and the seller gets money in T+2 days. So, if you buy some company shares on Tuesday, the shares will be credited to your Demat account on Thursday. While counting T+2 days, holidays in exchanges are excluded. So, if there's a holiday in between, the delivery period is extended.

What if you got an opportunity to book the profits or losses between those 2 days? You cannot take this opportunity as it's a normal order. This may result in losses for the trader.

BTST solves this problem of traders by allowing them to buy or sell their securities before they are credited to their Demat account. This helps traders to benefit from short-term volatility in the price of the stocks.

Shoonya provides a BTST facility. 


",,,,,,
What is an Option Chain?,"An options chain is a table displaying options quotes for a particular underlying security. The options chain matrix is updated in real-time showing the last price, trading volume, and best bid and offer for the calls and puts of an options series, typically segmented by expiration date.

An option's strike price is also listed, which is the stock price at which the investor buys the stock if the option is exercised.

",,,,,,
What is the difference between CE and PE?,"CE and PE stand for “Call option” and “Put option” in the stock market which is the derivative contract that gives its owner the right and not the obligation to buy or sell an underlying asset at an agreed-upon price within a certain time period.

Call option offers its holder or the buyer the “right to buy” a particular asset at the agreed-upon price i.e. the strike price on or before the expiration date in return for a premium paid to the seller or the writer of the option contract.

Put option offers its holder or the buyer the “right to sell” a particular asset at the agreed-upon price i.e. the strike price on or before the expiration date in return for a premium paid to the seller or the writer of the option contract.",,,,,,
What is the difference between futures and cash markets?,"FUTURE MARKET - A future market is a place where only futures contracts are bought and sold at an agreed date in the future and at a predefined price. You can never be a shareholder when you trade in Futures. No delivery takes place as the Future contract expires on the expiration date. Only margin money required to be paid for initiating the Future contract. One has to buy a minimum lot size which is already defined. Such as in the case of NIFTY lot size is 75. In futures, you have to settle the contract on the expiration date i.e. maximum of three months.
In a future contract, you are not entitled to any dividend

Can be a shareholder for F&o stocks like reliance, Bhel, etc, only non-deliverable contracts are of an index like nifty.
CASH MARKET

A cash market is a marketplace in which securities purchased are paid for and received at the point of sale. For example, a stock exchange is a cash market because investors receive shares immediately in exchange for cash.
Demat settlement of T+2 days takes place on account for bought holding and client become a shareholder of a stock company. It is done on T+2 days.
The full amount needs to be paid at the time of buying shares in cash. One can buy even a single share of a company.  ",,,,,,
What is GTT order?,"GTT (Good till triggered) is a feature that allows you to set a trigger price, such that if your trigger price is hit on a future date, a limit order will be placed on the exchange as per the limit price and preset conditions set by you.

GTT is available for Shoonya for all the segments. If wants to palace sell GTT order then the account needs to be linked with POA first. The validity of GTT is up to 1 year.
Is It Useful?
GTT orders make your trading/investing experience more convenient. Here’s how they prove beneficial:
You do not need to log in every day to place a limit order during the trading session.
You have more flexibility in terms of placing an order with a longer horizon in mind.
Your monitoring efforts are reduced. If you are an investor who is looking to sell/buy a desired quantity of shares at the desired price within a custom time frame, without half the effort – GTT is your best bet.",,,,,,
What is dividend?,"Shareholders earn returns on their investment in equity in two ways; the first being capital appreciation and the second by receiving dividends that companies pay to their shareholders.
A dividend is a payment made by a corporation to its shareholders. If you’re a shareholder, you can think of a dividend as your share of the company’s profits.

You will be eligible for dividends If you’ve purchased the stocks before the ex-date. If you've purchased the shares on or after the ex-date, you will not be eligible for the dividend.

These payments are usually made in cash which is known as a cash dividend but in some cases, they may choose to make these payouts in the form of stocks too which is known as a stock dividend. The client will get dividends in his linked bank account with the Demat account. 

The dividend yield is often an essential factor for investors when choosing which stocks to invest in. The dividend yield is calculated on the current share price.
Example: If ABC Ltd declares a dividend of Rs.5/share and the market value of the share is Rs.250 then:
Dividend Yield = Full-year Dividend/Current Share Price
In this case it is: 5/250 = 0.02 or 2%  ",,,,,,
How many GTT orders can I place for one account?,There is no limit to place GTT orders but it will check the margin available when the price triggers.,,,,,,
What is an Exchange Traded Fund (ETF)?,"An exchange-traded fund (ETF) is a type of security that tracks an index, sector, commodity, or other assets, but which can be purchased or sold on a stock exchange the same as a regular stock. ETF share prices fluctuate all day as the ETF is bought and sold; this is different from mutual funds that only trade once a day after the market closes. ETFs offer low expense ratios than buying the stocks individually.

An ETF (Exchange-traded fund) is a basket of securities that tracks an underlying index. For example, a Nifty 50 ETF tracks the composition of the Nifty 50 Index. When you buy a Nifty ETF, you are getting exposure to the 50 stocks that form the Index.
",,,,,,
What are OTM options?,"""Out of the money"" (OTM) is an expression used to describe an option contract that only contains an extrinsic value. These options will have a delta of less than 50.0. An OTM call option will have a strike price that is higher than the market price of the underlying asset. Alternatively, an OTM put option has a strike price that is lower than the market price of the underlying asset.

OTM options have less extrinsic (time) value than ITM options, which in turn makes them more desirable to traders with smaller amounts of capital. OTM options are more commonly traded for strategies such as covered calls or protective puts.

You can trade in OTM options with Shoonya (3 months contracts). There are no restrictions on the trading of OTM options with us. 

",,,,,,
What is Short selling?,"Short selling is the selling of a stock that the seller doesn't own. More specifically, a short sale is the sale of a security that isn't owned by the seller, but that is promised to be delivered. Short selling is an investment or trading strategy that speculates on the decline in a stock or other security's price.

You can short sell in equity (Intraday only) & derivatives (Intraday & carry both). ",,,,,,
What happens when I dont squared off my short position?,"In case your Intraday Equity short position is not squared off due to the absence of buyers or failed due to any reasons. This will be considered as short delivery, which means the seller of the shares has defaulted on the settlement of shares hence the exchange participates in the auction market on T+2 days. The exchange holds an auction for the same quantity of shares & delivers it to the buyer.

The settlement of the auction shall be done on T+3 day (where T is the transaction day, holidays are not included).

Short delivery can happen in stocks with less liquidity or if an Intraday Equity position hasn’t been squared off in some circumstances. As a result, appropriate margins would be blocked in your account. The blocked amount will be released once the auction settlement process is completed on T+3.",,,,,,
What is OFS and how we can apply for the same?,"A private company launches an Initial Public Offering (IPO) for additional funding. The company sells shares to outside investors to access funds for various purposes. This includes the growth and expansion of the company. 

However, the company’s financial problems do not end with an IPO. Sometimes, a company may need additional capital to meet its goals. That’s the time such companies can opt to go for an Offer for Sale (OFS).

An offer for sale (OFS) is a mechanism that allows promoters to reduce their holdings in listed companies transparently. These shares sold by the promoters are offered for sale directly to the public through a bidding process.

The client can place an OFS order from 9.15 am to 3 pm.

All you need just to do is mail us at clientsupport@shoonya.com or raise a ticket from the PRISM portal with the specified details of the OFS you want to purchase, like the name of the script, price, and quantity with your assigned client code.

As per SEBI OFS guidelines, all investor bids must be backed by a 100% cash upfront margin. Else the bids would be rejected due to insufficient collateral.",,,,,,
When should the client need to square off to avoid physical delivery in all segments?,"You can square off your FNO positions before market close on expiry day.In MCX and NCDEX you need to squared-off your positions one day before the Tender Period. You can check the Tender period of all commodities from the MCX website.

  ",,,,,,
What will happen if I forget to square off the position before expiry contract?,"It will settle according to the closing price in cash.

",,,,,,
What will happen if any stock reaches its upper or lower limit?,"In case of short selling If the stock is in the upper circuit, it will go in Auction and settled by the exchange on T+2 days. and in case of buy position it will go to your holdings.",,,,,,
Can the client do buy and sell if stock is in the upper or lower circuit limit?,"No, you cannot trade in case stock is in upper or lower circuit limit.You can only make a bid and wait for buyers/sellers.",,,,,,
"How many months future and option contracts are allowed for trading in NFO, CDS and MCX with Finvasia?","Equity Futures & Options - 3 Months contracts

MCX - Current 2 contracts

CDS - 3 Months contracts",,,,,,
Is STBT is allowed with Finvasia?,No STBT (Sell today buy tomorrow) is not available in equity cash segment.,,,,,,
Do we allow trading in ASM and GSM shares?,"We only Allow buying and selling in CNC in ASM stocks. Currently, you cannot trade in GSM category shares. You can sell your existing holdings in the GSM category.",,,,,,
In which segments bracket order and cover order are allowed?,"Bracket order and Cover order are available in the following segments: 

NSE/BSE Cash in EQ series.

Future stocks - in the current month's contract.

Future index: - In the current month's contract.

CDS --In USDINR only.

MCX Futures in current month contracts except for Agri Commodities.

CO & BO are not available in options and all CDS currency pairs except USDINR.",,,,,,
"Is Bracket order or Cover order allowed on AMO orders on web, mobile and exe?","No Bracket order and cover order are available for Intraday trades only.

",,,,,,
What is multi-leg order and how it can be placed?,"A multi-leg options order is an order to simultaneously buy and sell options with more than one strike price, expiration date or sensitivity to the underlying asset's price. Basically a multi-leg options order refers to any trade that involves two or more options that are completed at once.

You need to go to Trade --- Multileg order in Shoonya Exe.",,,,,,
What are the benefits of multi-leg order?,A multi-leg option order submits both legs of the trade simultaneously making execution much smoother for the options trader. Moreover having both orders go in at the same time removes some of the latency risk and time lag of entering multiple option positions manually.,,,,,,
When can trade to trade shares are allowed to buy and sell?,Client can buy anytime in the market and can sell after t+2 days only. The client is not permitted to do intraday trading or BTST.,,,,,,
Where can we find the stock category and leverage details?,"You can check the stock category and leverage details from our margin calculator. Please find below link:

https://www.finvasia.com/calculators",,,,,,
How many far ITM and OTM expiries or contracts are allowed for trading?,"You can trade at all the available strike prices including ITM & OTM in 3 months Futures & Options contracts. There are no restrictions on any strike price from our side.
",,,,,,
In which currency pair I can use Bracket order?,Bracket order is available in USDINR currency pair only.,,,,,,
How to Place a GTT order?,"GTT(Good till triggered) is a feature that allows you to set a trigger price, such that if your trigger price is hit on a future date, a limit order will be placed on the exchange as per the limit price and preset conditions set by you.

Please find below a youtube video of “How to place GTT order on Shoonya Mobile” -

https://www.youtube.com/watch?v=wAZ2vc-LIEA",,,,,,
