Question,Answer,,,,,,
What is a Hedge Margin?,"A hedge is an investment that is made with the intention of reducing the risk of adverse price movements in an asset. Normally, a hedge consists of taking an offsetting or opposite position in a related security.",,,,,,
What is peak margin?,The minimum margin has to be in the client's trading account before placing an order in any segment. Clearing corporations will randomly take 4 snapshots at predefined time windows for arriving at such peak margin requirements on open positions during the day. The highest margin requirement from these 4 snapshots will be the Peak Margin.This aims to curb the excessive leverage for intraday and derivatives positions.,,,,,,
What is the exposure margin?,"An additional margin over and above the Span margin is collected, known as the Exposure margin. It is like an adhoc margin calculated on the value of the exposure taken. The margin is blocked over and above the span to support any MTM losses. For Index, it is 2%, and for stocks, it is 3.5%.",,,,,,
What is the Span margin?,Span margin is an initial margin which is calculated based on the risk and volatility of the underlying asset.,,,,,,
What is a Margin call?,"When the value of a trader's margin account falls below the exchange's required amount, a margin call occurs. In case of a margin call, the trader either has to deposit more funds in their account or square off any open position from their account.",,,,,,
Do I have to bear a penalty in case of a margin shortfall?,"In case of a margin shortfall for the first time, the trader will be charged 1% of the amount. However, if a trader fails to maintain the margin amount three times in a month, then 5% of the amount will be charged.",,,,,,
Does Shoonya provide leverage for delivery positions?,"No, we don’t provide leverage for delivery/carry forward position at the moment.",,,,,,
Why have I not received full credit against the sell value of my holdings?,"As per SEBI's peak margin rules, if you sell shares from your Demat, then only 80% credit against the sale value will be available for subsequent trades in the segments on the selling day. ",,,,,,
How peak margin affects margin for hedge positions?,"If the trades placed are hedged, then there is a benefit of margin. To avoid a peak margin, it is important to square off the leg of the transaction that has high margin requirements first in order to square off the hedge position. If this procedure is not followed, the peak margin requirement will rise, and in case of insufficient margin, it will result in a penalty.",,,,,,
What is Order Level Hedge Benefit?,"As per the SEBI Circular and NSE Circular in 2020, the margin required for trading in the equity derivatives was revised from 1st June 2020. As per the circular, the margin requirement will reduce significantly and naked positions in F&O will need to bring in more margin money to hold the positions. To provide clients with the benefit from the new margin policy, one can avail of the order-level hedge benefit, i.e. while placing hedged trades.",,,,,,
How will you get a hedge margin benefit?,"With effect from 1st June 2020, NSE’s new Margin Policy Framework has structurally changed how margins are calculated. The reduction in margin requirement for several hedged options strategies with the least risk potential has been reduced to almost 70% of what was required earlier(depending on the position).  Example: If you sell nifty futures and buy a call option to hedge. Sell Nifty Future at 14500 Buy NIFTY CE of strike price 14500.  Span Margin: 0.00 Exposure Margin : 21784.88 Total Amount Required : 21784.88  Margin Benefit: 141645.0",,,,,,
What is Trade Level Hedge Benefit?,"As for trade level, a full margin is required for making hedged positions. After positions are opened, the margin will be released.",,,,,,
Will I get a Hedge margin benefit only for overnight position trades?,"You will get hedge margin benefits on both intraday and overnight position trades. To get a hedging margin benefit, you need to place an order in the ""NRML"" product type. ",,,,,,
What is a short margin? when it will occur?,"When trades are performed without sufficient margin (SPAN and Exposure for F&O and VAR+ELM+Adhoc for equity), net buy premium, physical delivery margins and marked-to-market losses (if applicable) as prescribed by the exchange. In case of a margin shortfall for the first time, the trader will be charged 1% of the amount. However, if a trader fails to maintain the margin amount three times a month, 5% of the amount will be charged.",,,,,,
How to get hedge benefit in basket order?,"In basket orders, you need to provide a margin as per your highest margin orders. Once the orders are executed, you will get hedging margin benefits, and additional margin will be released.",,,,,,
Do we have allowed pledging against MF?,"--Yes, you can pledge mutual funds to get the collateral margin. Below is the link to learn about the list of approved Mutual Funds for collateral margins: https://docs.google.com/spreadsheets/d/1Fl2OyRfaVOgygaMMs08ObsZYYP9sx8u8woM4cJiFx5E/edit#gid=0
What", which blocks the client's holdings to that extent automatically. The DP releases the request to CDSL and sends the request form to the Issuer/ R&T agent. The Issuer/ R&T agent then prints the certificates, dispatches the same to the client and simultaneously electronically confirms the acceptance of the request to CDSL. Thereafter," the client's blocked balances are debited.""",,,
How do I transfer shares from another DEMAT account to my Shoonya DEMAT?,"You can transfer shares from your other Demat account to your Finvasia account through various ways: 1. Through DIS (Delivery Instruction Slip): You can transfer your holdings filling in DIS. In beneficiary, you need to fill in your DP details of Shoonya and submit them to your old broker.2. Through CDSL EASIEST: You can also transfer your holdings through CDSL easiest. ",,,,,,
What is DP ID and BOID?,BOID is Beneficial Owner Identification Number or Demat Account Number which is of 16 digits consisting of 08 digits DP ID and 08 digits Client ID. It is unique for every client. You can get your BOID from the back office or PRISM. ,,,,,,
What are the charges for converting physical shares into Demat?,Charges are Rs 15 per certificate + 99 courier charges.,,,,,,
"If I have multiple demat accounts with different brokers,  how do I see my holdings across the 3 brokers on CDSL's easiest platform?
","You can register on the ""CDSL easi"" facility and link all your demat accounts with different brokers in it. This access is for view only. You can not do any share transfer or any other transaction in it. You can view all your holdings across all the dem",,,,,,
Can I dematerialise shares held by a single owner in a joint demat account?,"Physical shares held by a single holder cannot be dematerialised in a joint demat account. To dematerialise shares, the name on the share certificate should match the name on the demat account.",,,,,,
Where can I check my financial ledger PNL report?,"You can check all reports in our back office. Please find the link below:   https://reports.shoonya.com/ Login ID - <Client code> Password - Enter a password (If you do not remember, you can reset the password by clicking on forgot password) You can check contract notes, financial ledger, holdings, balance, Profit and loss Statements, and other important reports. ",,,,,,
What is the difference between the Date and value date in the back office?,"In your financial ledger, there are 2 options: One is DATE, and another is VALUE DATE.Date - The timestamp for when the transaction is created in the system.Value date: A value date is a future date that is used for determining the present value of a product or security that fluctuates in price. It is the date at which funds, assets, or money's value becomes effective. ",,,,,,
How do I log in to the back office and its overview?,Here is the link for the Back office: https://reports.shoonya.com/ Please select Client log-in and financial year. Password - Enter Password (You can also follow forgot password link) Please find the below link to the back-office overview: https://www.youtube.com/watch?v=757615gjKx8&t=70s,,,,,,
How to view and download the profit and loss report?,"Please find below the steps to get the profit & loss report - 1. Please log in to our back office : https://reports.shoonya.com 2. Click on ""P&L Report"". 3. Select the date range. 4. You can view and download the report in Excel & PDF. Please find the video below for more details -  Overview of the New Back Office Portal (Hindi) - https://www.youtube.com/watch?v=47D5vlqduwo",,,,,,
How do you check the purchase price of the holdings and positions in Shoonya?,"you can check the average buy price of your holdings in the “Holding” tab in Shoonya.  for derivative segments, you can check the average buy/sell price of your carry positions  your back office in contract note, trade confirmation, or in net positions.",,,,,,
How do you download contract notes from the back office?,"Please find below the YouTube video link of ""How to download Contract Notes from Back Office."" - https://www.youtube.com/watch?v=wjs6UmAnnGM",,,,,,
"Brief overview for back-office options like what is the ledger balance, less margin, and net balance?","When you log in to your back office on the dashboard, there are a few options: 1. Ledger Balance: - The Ledger balance shows the balance available in your ledger report after setting off the trade amount, i.e., after setting off the outstanding dues against the available balance, the total balance shown in your ledger balance.2. Less Margin: - This is the margin you use in your derivatives position.  3. Net Balance: - Net balance is the difference between Ledger balance and less margin. Net balance = (Ledger Margin – Less margin)",,,,,,
What is a consolidated crystallised obligation?,"This column shows the sum of MTM losses, if any, in the respective segment in the daily margin statement.",,,,,,
How do we figure out how many shares are pledged of a particular scrip?,"You can see your pledged stock from the back office under the Demat holdings (beneficiary + depository) head. There, you can see all your DP details like Pledge stocks, Pledge Value, Var, DP lock stocks, quantity, and var percentage of the scrip. You can also check your pledged margin in Shoonya; it will reflect under your limits as ""Collaterals"" and 'MF Collaterals"".",,,,,,
What is the difference between JOBBING & SHORT TERM profit and loss?,"Jobbing is like the buying and selling of shares or securities, especially on a small scale, with the intention of generating quick profit. Buying or Selling of security and then immediately buying it back or selling it back for a quick profit. Example: In the case of intra-day trading in shares, there is no actual delivery as the shares enter and exit from the trading account on the same date, and it does not enter the DEMAT account at all. Intra-day trading is the trading of shares within the same day. Generally, the delivery is not taken in the case of intra-day trading. Thus, they are called speculative transactions. Therefore, based on the definition, it can be inferred that intra-day trading income is speculative income. Short-term Profit/loss: Shares that are listed on a recognised stock exchange and have been held for less than 12 months are treated as short-term capital. The proceeds earned through them are treated as short-term capital gains and are liable for taxation.",,,,,,
Why do the back office and Shoonya show different balances?,"There can be some differences in the balances of the Back-office and Shoonya due to pay-in, payouts, and trade settlement posting. It will be updated as per the settlement date of funds and trades.",,,,,,
How do we update the buying price of transferred shares?,"When you transfer shares from another Demat account, we may not have information about the prices at which those stocks were originally bought. To make it convenient for you to track the value of your investments, we allow you to input the average prices and purchase dates for these transferred stocks. Here are the simple steps to follow: 1. Log in to your Back Office: Visit https://reports.shoonya.com/ and open the P&L Report Tab from the dashboard. 2. Select a Date Range: In the Equity PL section, click on the Date Range Flag and choose the desired date range. 3. Access Stock Entry: Click on the Stock Entry tab located on the right side of the screen. 4. Search for the Scrip Name: Enter the name of the scrip (stock) you want to update. 5. Add Scrip Details: Provide the necessary details for the scrip, including quantity, price, and date of purchase. 6. Update Scrip Record: Review the information you've entered on the right side of the screen and ensure it's accurate. 7. Save Data: Click on the ""Record Added"" tab. A new tab will open. If you notice any incorrect data, you can remove it before saving. Note: Once you've updated the information in the back office, please allow up to 24 working hours for the changes to reflect in Shoonya.",,,,,,
How to do E-voting in CDSL through Shoonya by Finvasia?,"In the normal course of business, companies introduce various resolutions related to corporate policies, board appointments, corporate actions, etc.; shareholders must approve that. Shareholders of the company can vote on these resolutions to either approve or reject them. All shareholders that hold the shares of the companies on the record date are eligible to vote. E-voting is a mechanism through which security holders of companies can vote on resolutions electronically anywhere and at any time during the voting period through the electronic voting system developed by NSDL and CDSL. Shoonya by Finvasia has simplified the e-voting process for shareholders by providing access to CDSL's e-voting system. Please find the video link below of ""How to do E-voting in CDSL through Shoonya by Finvasia""? https://youtu.be/kb1cKIvbQpU (E-voting English)    https://youtu.be/sjwwQex4zSo (E-voting Hindi)
What is Trading API?,A Trading API allows the trader to write their own computer programs for trading or using the third-party trading platform. Trading APIs are for traders who wish to run algorithmic models on their own trading systems", receive real-time pricing, and perform trades. The algo trading APIs help traders in building their own customized trading application. Traders can execute orders in real-time, manage user portfolios, stream live market data, and much more, with Trading API.
What types of APIs are provided by Finvasia?,"Currently, we provide the below APIs: 1. Python API 2. Dot net API 3. Node.JS
What are the charges of using the Shoonya developer's APIs?,There are no charges for using the Shoonya developer's APIs.
What are the benefits of using Shoonya developer APIs?,Finvasia APIs benefits: 1. Allows customization of the trading platform as per user needs. 2. Users get access to data that enables them to trade at their convenience. 3. Users can build their own trading platforms. 4. Automate your trades with custom entry and exit conditions. 5. Real-time order execution. 6. Market Snapshot and live market feed. 7. Zero brokerage cost for all the trades. 8. Zero charges for using APIs.",,,,,,
Can I integrate Amibroker with Finvasia APIs?,"Yes, you can integrate Amibroker with our APIs without any charges. Please find below the link of ""How to Integrate Amibroker with Shoonya"":- https://youtu.be/TXApp6GUDSQ
Where I can contact for APIs support?,You can email us all your APIs queries at apisupport@finvasia.in""",,,,,,
How to get Started with Shoonya Developer API?,"You need to have an active Trading account with Finvasia to generate the API Authentication keys. You can begin the integration of different trading APIs using the keys. Get started with using our APIs, detailed documentation for each of the APIs are available for reference on : https://finvasia.com/shoonya-api Please find the below YouTube link of ""Overview of Shoonya Developer APIs"": - https://youtu.be/k0RLjpQmYZY",,,,,,
How to generate or get an API key?,"Following Steps are needed to be followed for API key generation: - 1. log in to your PRISM portal. https://prism.finvasia.com/ 2. Click on “API Key” available on the top right. 3. Generate an API key 4. Copy and paste the API key to your software.
Please find below the YouTube video link of ""How to generate or get an API key from PRISM"" -  https://youtu.be/YbD-NDKGm-I",,,,,,
How long does it take to activate an API subscription?,"Once you subscribed to the API, you will be able to start using API instantly.",,,,,,
Will I be able to place orders in Derivative segments?,Our APIs are available for the below-given segments: 1. Equity 2. Equity derivatives 3. Currency 4. Commodities,,,,,,
Can we place orders from Finvasia Shoonya Developer APIs?,"Yes, you can place, cancel & modify orders from our APIs.",,,,,,
Are bracket and cover orders available in Finvasia APIs?,"Yes, our APIs allow us to Place/Modify/Cancel a Cover/Bracket order.",,,,,,
I am facing an issue with placing orders while running 2 python programs in parallel. It is executing orders only for the latest program whereas throwing an error for the 1st program.,You can use 1 API at one time. The session of the first login will be expired if you logged in to the second session.,,,,,,
How can I place a basket order in APIs?,"You need to call API to place order, you could group them using remarks field.",,,,,,
What happens if i logged in using API and did not logout due to network interruption?,Session will be valid till EOD or subsequent login.,,,,,,
How can i calculate margin for my positions? Whether I would need a code or function to integrate into my account or at least the formula to calculate margin in my code?,You have to make the API Limits method call to get the limits and margin used.,,,,,,
How to get the list of all instruments along with their token numbers through the Python API requests?,Please find the below link to get the list of all instruments along with their token numbers: https://github.com/Shoonya-Dev/ShoonyaApi-py/blob/master/tests/test_download_masters.py,,,,,,
What is the symbol format for the BankNifty option in API?,The Trade Symbol for BankNifty options will be SymbolDDMYYOptionTypeStrike. For Example- BANKNIFTY17FEB22P38600,,,,,,
What is the Command to Install the Libraries in Python?,Please run the below command to install libraries in your Python API: py -m pip install -r requirements.txt,,,,,,
What type of historical data I can check in APIs and how to fetch it?,There are 2 types of historical data: 1. get_time_price_series : 2. get_daily_price_series. Please find below the link of How to fetch historical data in APIs: - https://github.com/Shoonya-Dev/ShoonyaApi-py#md-get_time_price_series,,,,,,
What is the vendor Code in API?,The vendor code will be your Client Code_U  For Examples FA12345_U,,,,,,
What is the IMEI number in API?,You can set any default values like your device id/ MAC ID or any other value as per your choice in the program as an IMEI number. For example abc1234,,,,,,
How to call get position and getMTM for API trading?,Please check the code in the below link: https://github.com/Shoonya-Dev/ShoonyaApi-py#md-get_orderbook,,,,,,
"Can I get 5 min candle OHLC, RSI, and ADI from the API?","We provide 5 min data in OHLC (Open, High, Low & Close). RSI and ADI are technical indicators and we do not provide the same.",,,,,,
What is the Product Type for Intraday (MIS) in NSE Cash in API?,"You need to pass ""I"" in the API program for Intraday in the NSE Cash market.",,,,,,
What is the product Type for Delivery (CNC) in NSE Cash Market in API?,"You need to pass ""C"" in the API program for Delivery (CNC) in the NSE Cash market.",,,,,,
What is the Product Type for Intraday (MIS) in NSE Options?,"You need to pass ""M"" in the API program for Intraday (MIS) in the NSE options.",,,,,,
What is the maximum number of tokens that I can subscribe to in the WebSocket?,There are no such restrictions.,,,,,,
How to close the WebSocket?,"Please refer to ""Example_market"".",,,,,,
What are the types of feed available in the WebSocket?,"There are three types of feeds: - Depth, Order & Authline.",,,,,,
What is the frequency of the feed in WebSocket?,The frequency will be the same as provided by Exchange.,,,,,,
What are the types of feed available in the WebSocket?,"There are three types of feeds: - Depth, Order & Authline.",,,,,,
I tried python code to connect WebSocket with bank nifty spot live price. But it is not working. Can you share any sample program model for the same?,Please refer to: - test_websocket_feed in tests.,,,,,,
Which API can give open orders details?,Please find below details:  https://github.com/Shoonya-Dev/ShoonyaApi-py#md-get_orderbook Status Type:: Possible Values are PENDING CANCELED OPEN REJECTED COMPLETE TRIGGER_PENDING INVALID_STATUS_TYPE,,,,,,
What are the limits for placing the order in API?,"Currently, in our API, we provide 20 orders per second per service instance & 200 orders per minute per service instance. Any third-party developers should not send more than 20 orders per second and 200 orders per minute to avoid any trading rejections.",,,,,,
Will Finvasia help me to code my trading strategies based on my logic?,Currently Finvasia does not provide such kind of services. You need to contact our Third-Party vendors for the same.,,,,,,
Do you have any curl-based codes?,"Yes, In the Shoonya REST API Backend we are using Curl-Based Codes.",,,,,,
What is the product Type for NRML in NSE Cash Market in APIs?,"You need to pass ""M"" in the API program for (NRML) in the NSE Cash market.",,,,,,
What should I feed to execute Banknifty future symbol in the API?,"Please find the examples provided on the shoonya python Git page under the WebSocket subscribe section.

https://github.com/Shoonya-Dev/ShoonyaApi-py#-searchscripexchange-searchtext",,,,,,
How can I check if my orders have been successfully executed or not from the Response Details?,"You will get a response ""Order has been successfully executed"".",,,,,,
Do you offer paper trading accounts for testing & development?,"Currently, we don't provide the paper trading facility, But we provide UAT Environment (User Authentication) for testing.

For more information, please contact us at apisupport@finvasia.in",,,,,,
What is the maximum number of tokens that I can subscribe to in the WebSocket?,There are no such restrictions.,,,,,,
How to close the WebSocket?,"Please refer to ""Example_market"".",,,,,,
What are the types of feed available in the WebSocket?,"There are three types of feeds: - Depth, Order & Authline.",,,,,,
What is the frequency of the feed in WebSocket?,The frequency will be the same as provided by Exchange.,,,,,,
How can I get market status (open or close) using WebSocket?,"Currently, this facility is not available. You can not check the market status in API.",,,,,,
What is the maximum number of tokens that I can subscribe to in the WebSocket?,"Currently, Finvasia does not provide such kind of services. You need to contact our Third-Party vendors for the same.",,,,,,
Do you have any curl-based codes?,"Yes, In the Shoonya REST API Backend we are using Curl-Based Codes.",,,,,,
What is the product Type for NRML in NSE Cash Market in APIs?,"You need to pass ""M"" in the API program for (NRML) in the NSE Cash market.",,,,,,
What should I feed to execute Banknifty future symbol in the API?,"Please find the examples provided on the shoonya python Git page under the WebSocket subscribe section.

https://github.com/Shoonya-Dev/ShoonyaApi-py#-searchscripexchange-searchtext",,,,,,
Can I integrate TradingView data using Shoonya APIs?,"Yes, you can integrate TradingView data using Shoonya APIs.",,,,,,
How can I check if my orders have been successfully executed or not from the Response Details? ,"You will get a response ""Order has been successfully executed"". ",,,,,,
Do you offer paper trading accounts for testing & development?,"Currently, we don't provide the paper trading facility, But we provide UAT Environment (User Authentication) for testing.

For more information, please contact us at apisupport@finvasia.in",,,,,,
"I want to run strategy for multiple accounts of my family, when I create an individual instance for each user, WebSockets does not work for all the users. How to fix it?",You can use the Threading functionality for multiple accounts.,,,,,,
"I am using DotNet API and getting the Response Data, stat Not OK emsg Session Expired User ID and Account ID, How to Fix it?",You need to mention User ID or Account ID in the respective field.,,,,,,
What is the product Type for Bracket Order (BO) in NSE Cash and Future Market in API?,"You need to pass ""B"" in the API program for Bracket Order (BO) in the NSE Cash and Future market.",,,,,,
What is the pip update command in Python?,"Please find the below pip update command:- 

python -m pip install -–upgrade pip
",,,,,,
,,,,,,,
What is the product Type for Cover Order ( CO ) in NSE Cash and Future Market in API?,What is the maximum number of tokens that I can subscribe to in the WebSocket?,,,,,,
How to get an option chain?,"Please find below details to get option chain: -
api.get_option_chain(""NFO"", ""NIFTY14JUL22P16000"", 16000, 5)
",,,,,,
How to use API for Multiple accounts in a single program?,"Please find below the Sample code:- 
tests/test_multi_user_sessions.py
",,,,,,
Does Shoonya API allow streaming of live prices?,"Yes, Shoonya offers a Websocket service to stream live prices across all segments and exchanges.",,,,,,
